{
  "type": "array",
  "$schema": "http://json-schema.org/draft-04/schema#",
  "description": "",
  "minItems": 1,
  "uniqueItems": true,
  "items": {
    "type": "object",
    "required": [
      "uri",
      "name",
      "year_founded",
      "hqLatLng"
    ],
    "properties": {
      "uri": {
        "type": "string",
        "minLength": 1
      },
      "name": {
        "type": "string",
        "minLength": 1
      },
      "year_founded": {
        "type": "string",
        "minLength": 1
      },
      "hqLatLng": {
        "type": "object",
        "properties": {
          "lat": {
            "type": "number"
          },
          "lng": {
            "type": "number"
          }
        },
        "required": [
          "lat",
          "lng"
        ]
      }
    }
  }
}
